00HZa,6k1/6pp/1p6/p1n5/4qp2/1P2PN2/P4PPP/3Q2K1 b - - 0 28,f4e3 d1d8 g8f7 f3g5 f7g6 g5e4,951,81,94,327,crushing endgame fork long,https://lichess.org/WRMbDs53/black#55,
00HeG,8/1p5k/p3pQq1/3pP3/2p3P1/2P5/PP6/2K5 w - - 3 33,f6h4 g6h6 h4h6 h7h6,745,95,95,263,crushing endgame queenEndgame short,https://lichess.org/Fe29uA9P#64,
00HnR,q5kr/p4p2/3Bb1p1/4p2p/5n2/2P5/P1Q2PPP/3R1RK1 w - - 4 21,d6e5 a8g2,633,118,100,19,mate mateIn1 middlegame oneMove,https://lichess.org/Iva57KFW#40,
00HoG,5r1k/5r2/2b2RQp/1p1p2p1/1q4P1/8/8/1B3R1K b - - 0 36,f7f6 g6h7,1528,79,93,2849,mate mateIn1 middlegame oneMove,https://lichess.org/zwJu9mKP/black#71,
00Htd,rnbqk2r/1p3ppp/p4b2/2Pp4/8/2N2N2/PP2PPPP/R2QKB1R w KQkq - 0 9,d1d5 f6c3 b2c3 d8d5,979,86,93,1003,crushing intermezzo opening short,https://lichess.org/ZWQwqa9S#16,Tarrasch_Defense Tarrasch_Defense_Two_Knights_Variation
00Hxb,1rbr1k2/p4ppp/2B5/2pR1NP1/2P5/P7/7P/4R1K1 b - - 0 27,d8d5 e1e8,1126,80,83,1101,endgame mate mateIn1 oneMove,https://lichess.org/FW9LwaHK/black#53,
00HzH,2r2Qk1/p2q2p1/1p2p1Np/3p3P/3Pb1P1/2P5/PP3R2/6K1 b - - 4 33,c8f8 f2f8 g8h7 f8h8,802,83,90,350,endgame hookMate mate mateIn2 short,https://lichess.org/XB8lgZ9N/black#65,
00HzX,4r1k1/5pp1/2R4p/1p6/8/1PP3QP/2q2PP1/6K1 w - - 0 29,c6h6 c2c1 g1h2 c1h6,1607,75,94,1040,crushing endgame fork short,https://lichess.org/tKKATkce#56,
00ICz,2k2rr1/1p1q3p/1p2p3/1NbpQ3/P1p2P2/6P1/6KP/R4R2 b - - 0 31,f8f5 b5a7 c8d8 e5b8 d8e7 b8g8,1326,76,98,1892,crushing long middlegame skewer,https://lichess.org/aGEDdbh2/black#61,
00IDw,4r3/pN3kpp/2N1b3/2R5/5b2/P7/1P3PPP/7K w - - 1 30,g2g3 e6h3 c5c1 f4c1,1875,75,86,148,advantage endgame quietMove short,https://lichess.org/KmTVU8Fo#58,
00IF1,1k6/p1p5/P2p4/3P4/1PK2N1p/4P3/5r2/4B3 b - - 12 57,f2f4 e3f4 h4h3 e1g3,1183,78,92,512,crushing defensiveMove endgame hangingPiece short,https://lichess.org/bX3dAdx9/black#113,
00IF7,b3k2r/4bpp1/2q1p2p/1p1nP3/1Pp1N3/2P5/2B2PPP/2BQR1K1 w k - 0 19,c1e3 d5c3 d1g4 c3e4,1652,80,64,35,crushing middlegame short,https://lichess.org/7PRHzjIO#36,Sicilian_Defense Sicilian_Defense_Old_Sicilian
00IFk,r1b4r/ppk2ppp/2p5/3n2B1/2P5/6P1/P1P1B2P/2KR3R b - - 0 16,d5c3 g5f4 c7b6 c4c5 b6c5 f4e3,2122,76,85,117,attraction crushing long middlegame,https://lichess.org/aDBJY27j/black#31,Philidor_Defense Philidor_Defense_Lion_Variation
00IHi,8/4R3/1k6/8/p7/1p1N2P1/5KP1/r7 w - - 0 55,e7e1 a1e1 f2e1 a4a3 e1d2 a3a2 d2c3 a2a1q,1829,75,97,1074,advancedPawn crushing endgame promotion veryLong,https://lichess.org/DiBepPdz#108,
00IPp,4Q3/6pk/p3p2p/5p2/1p1P2P1/4q2P/2B1n2B/7K w - - 0 35,g4f5 e3f3,1568,87,88,1862,endgame mate mateIn1 oneMove,https://lichess.org/JKNcTJw1#68,
00ISm,5r2/4bp1k/2ppq1p1/4p1Q1/4N2P/3P4/1P1R1P2/4K1R1 b - - 0 29,e7g5 e4g5 h7h6 g5e6,907,88,84,84,crushing endgame fork short,https://lichess.org/Nx7iGvHH/black#57,
00ITc,3r1rk1/3b1pp1/7p/8/N2Qp1n1/1P6/PB1q1PP1/R5K1 b - - 1 25,d7a4 d4g7,925,79,88,118,mate mateIn1 middlegame oneMove,https://lichess.org/tGroDLV4/black#49,
00IUT,1r2r1k1/ppp1q1pp/4b3/4P3/1Q1p1P2/8/P5PP/R1BR2K1 w - - 6 19,d1d4 c7c5 b4a3 c5d4 a3e7 e8e7,1554,75,94,21147,crushing fork long middlegame,https://lichess.org/93xXeKdX#36,Italian_Game Italian_Game_Classical_Variation
00IYH,rnbq1rk1/ppp2pp1/3p1n1p/2b1p2N/2B1P3/3P4/PPP2PPP/RNBQ1RK1 b - - 2 7,c8g4 h5f6 d8f6 d1g4,1007,83,93,2250,advantage kingsideAttack opening short,https://lichess.org/D9n0j4f5/black#13,Kings_Pawn_Game Kings_Pawn_Game_Alapin_Opening
